/home/tricorder/yang/anaconda3/envs/llama_alpaca_lora/lib/python3.10/site-packages/bitsandbytes/cuda_setup/main.py:145: UserWarning: /home/tricorder/yang/anaconda3/envs/llama_alpaca_lora did not contain ['libcudart.so', 'libcudart.so.11.0', 'libcudart.so.12.0'] as expected! Searching further paths...
  warn(msg)

===================================BUG REPORT===================================
Welcome to bitsandbytes. For bug reports, please run

python -m bitsandbytes

 and submit this information together with your error trace to: https://github.com/TimDettmers/bitsandbytes/issues
================================================================================
bin /home/tricorder/yang/anaconda3/envs/llama_alpaca_lora/lib/python3.10/site-packages/bitsandbytes/libbitsandbytes_cuda117.so
CUDA SETUP: CUDA runtime path found: /usr/local/cuda-11.7/lib64/libcudart.so.11.0
CUDA SETUP: Highest compute capability among GPUs detected: 8.0
CUDA SETUP: Detected CUDA version 117
CUDA SETUP: Loading binary /home/tricorder/yang/anaconda3/envs/llama_alpaca_lora/lib/python3.10/site-packages/bitsandbytes/libbitsandbytes_cuda117.so...
Training Alpaca-LoRA model with params:
base_model: /home/tricorder/test/gxc/decapoda-research/llama-7b-hf
data_path: ../data/alpaca_data.json
output_dir: ../lora_alpaca_output_free/source_2048
batch_size: 2048
micro_batch_size: 4
num_epochs: 3
learning_rate: 2e-05
cutoff_len: 512
val_set_size: 2000
lora_r: 8
lora_alpha: 16
lora_dropout: 0.05
lora_target_modules: ['q_proj', 'v_proj']
train_on_inputs:  
add_eos_token:  
group_by_length: True
wandb_project: llama_test_project
wandb_run_name:  
wandb_watch: gradients
wandb_log_model:  
resume_from_checkpoint:  
prompt template: alpaca

Loading checkpoint shards:   0%|          | 0/33 [00:00<?, ?it/s]Loading checkpoint shards:   3%|▎         | 1/33 [00:00<00:12,  2.47it/s]Loading checkpoint shards:   6%|▌         | 2/33 [00:00<00:11,  2.59it/s]Loading checkpoint shards:   9%|▉         | 3/33 [00:01<00:11,  2.63it/s]Loading checkpoint shards:  12%|█▁        | 4/33 [00:01<00:11,  2.62it/s]Loading checkpoint shards:  15%|█▌        | 5/33 [00:01<00:10,  2.64it/s]Loading checkpoint shards:  18%|█▊        | 6/33 [00:02<00:10,  2.63it/s]Loading checkpoint shards:  21%|██        | 7/33 [00:02<00:09,  2.62it/s]Loading checkpoint shards:  24%|██▁       | 8/33 [00:03<00:09,  2.63it/s]Loading checkpoint shards:  27%|██▋       | 9/33 [00:03<00:09,  2.62it/s]Loading checkpoint shards:  30%|███       | 10/33 [00:03<00:08,  2.63it/s]Loading checkpoint shards:  33%|███▎      | 11/33 [00:04<00:08,  2.62it/s]Loading checkpoint shards:  36%|███▋      | 12/33 [00:04<00:08,  2.62it/s]Loading checkpoint shards:  39%|███▉      | 13/33 [00:04<00:07,  2.64it/s]Loading checkpoint shards:  42%|████▁     | 14/33 [00:05<00:07,  2.51it/s]Loading checkpoint shards:  45%|████▌     | 15/33 [00:05<00:07,  2.55it/s]Loading checkpoint shards:  48%|████▊     | 16/33 [00:06<00:06,  2.52it/s]Loading checkpoint shards:  52%|█████▁    | 17/33 [00:06<00:06,  2.56it/s]Loading checkpoint shards:  55%|█████▁    | 18/33 [00:06<00:05,  2.56it/s]Loading checkpoint shards:  58%|█████▊    | 19/33 [00:07<00:05,  2.59it/s]Loading checkpoint shards:  61%|██████    | 20/33 [00:07<00:05,  2.60it/s]Loading checkpoint shards:  64%|██████▎   | 21/33 [00:08<00:04,  2.58it/s]Loading checkpoint shards:  67%|██████▋   | 22/33 [00:08<00:04,  2.60it/s]Loading checkpoint shards:  70%|██████▉   | 23/33 [00:08<00:03,  2.61it/s]Loading checkpoint shards:  73%|███████▎  | 24/33 [00:09<00:03,  2.61it/s]Loading checkpoint shards:  76%|███████▌  | 25/33 [00:09<00:03,  2.60it/s]Loading checkpoint shards:  79%|███████▉  | 26/33 [00:10<00:02,  2.62it/s]Loading checkpoint shards:  82%|████████▁ | 27/33 [00:10<00:02,  2.63it/s]Loading checkpoint shards:  85%|████████▁ | 28/33 [00:10<00:01,  2.65it/s]Loading checkpoint shards:  88%|████████▊ | 29/33 [00:11<00:01,  2.69it/s]Loading checkpoint shards:  91%|█████████ | 30/33 [00:11<00:01,  2.68it/s]Loading checkpoint shards:  94%|█████████▁| 31/33 [00:11<00:00,  2.67it/s]Loading checkpoint shards:  97%|█████████▋| 32/33 [00:12<00:00,  2.67it/s]Loading checkpoint shards: 100%|██████████| 33/33 [00:12<00:00,  2.52it/s]Loading checkpoint shards: 100%|██████████| 33/33 [00:12<00:00,  2.60it/s]
The tokenizer class you load from this checkpoint is not the same type as the class this function is called from. It may result in unexpected tokenization. 
The tokenizer class you load from this checkpoint is 'LLaMATokenizer'. 
The class this function is called from is 'LlamaTokenizer'.
Found cached dataset json (/home/tricorder/yang/datasets/json/default-50b57c6e99b706ed/0.0.0/e347ab1c932092252e717ff3f949105a4dd28b27e842dd53157d2f72e276c2e4)
  0%|          | 0/1 [00:00<?, ?it/s]100%|██████████| 1/1 [00:00<00:00, 464.95it/s]
Loading cached split indices for dataset at /home/tricorder/yang/datasets/json/default-50b57c6e99b706ed/0.0.0/e347ab1c932092252e717ff3f949105a4dd28b27e842dd53157d2f72e276c2e4/cache-221ef8c5005ddf18.arrow and /home/tricorder/yang/datasets/json/default-50b57c6e99b706ed/0.0.0/e347ab1c932092252e717ff3f949105a4dd28b27e842dd53157d2f72e276c2e4/cache-493ce87b5905320b.arrow
Checkpoint  /adapter_model.bin not found
trainable params: 4194304 || all params: 6742609920 || trainable%: 0.06220594176090199
Map:   0%|          | 0/50002 [00:00<?, ? examples/s]Map:   0%|          | 111/50002 [00:00<00:45, 1100.97 examples/s]Map:   0%|          | 224/50002 [00:00<00:44, 1109.05 examples/s]Map:   1%|          | 340/50002 [00:00<00:44, 1126.20 examples/s]Map:   1%|          | 453/50002 [00:00<00:44, 1123.00 examples/s]Map:   1%|          | 571/50002 [00:00<00:43, 1140.62 examples/s]Map:   1%|▁         | 741/50002 [00:00<00:43, 1135.09 examples/s]Map:   2%|▁         | 910/50002 [00:00<00:43, 1128.49 examples/s]Map:   2%|▁         | 1056/50002 [00:00<00:47, 1022.65 examples/s]Map:   2%|▁         | 1172/50002 [00:01<00:46, 1052.49 examples/s]Map:   3%|▎         | 1286/50002 [00:01<00:45, 1073.59 examples/s]Map:   3%|▎         | 1404/50002 [00:01<00:44, 1099.13 examples/s]Map:   3%|▎         | 1516/50002 [00:01<00:43, 1102.97 examples/s]Map:   3%|▎         | 1635/50002 [00:01<00:43, 1122.50 examples/s]Map:   4%|▎         | 1807/50002 [00:01<00:42, 1125.69 examples/s]Map:   4%|▁         | 1978/50002 [00:01<00:42, 1126.96 examples/s]Map:   4%|▁         | 2116/50002 [00:01<00:45, 1042.13 examples/s]Map:   4%|▁         | 2234/50002 [00:02<00:44, 1073.75 examples/s]Map:   5%|▁         | 2355/50002 [00:02<00:43, 1107.39 examples/s]Map:   5%|▁         | 2468/50002 [00:02<00:42, 1110.05 examples/s]Map:   5%|▌         | 2587/50002 [00:02<00:41, 1129.51 examples/s]Map:   5%|▌         | 2705/50002 [00:02<00:41, 1141.80 examples/s]Map:   6%|▌         | 2822/50002 [00:02<00:41, 1147.57 examples/s]Map:   6%|▌         | 2966/50002 [00:02<00:38, 1230.22 examples/s]Map:   6%|▋         | 3140/50002 [00:02<00:39, 1184.33 examples/s]Map:   7%|▋         | 3280/50002 [00:02<00:37, 1238.21 examples/s]Map:   7%|▋         | 3414/50002 [00:03<00:36, 1264.01 examples/s]Map:   7%|▋         | 3559/50002 [00:03<00:35, 1312.77 examples/s]Map:   7%|▋         | 3696/50002 [00:03<00:34, 1326.44 examples/s]Map:   8%|▊         | 3830/50002 [00:03<00:34, 1329.38 examples/s]Map:   8%|▊         | 3970/50002 [00:03<00:34, 1346.54 examples/s]Map:   8%|▊         | 4144/50002 [00:03<00:36, 1249.92 examples/s]Map:   9%|▊         | 4339/50002 [00:03<00:36, 1262.15 examples/s]Map:   9%|▉         | 4473/50002 [00:03<00:35, 1277.73 examples/s]Map:   9%|▉         | 4608/50002 [00:03<00:35, 1293.68 examples/s]Map:   9%|▉         | 4740/50002 [00:04<00:34, 1299.06 examples/s]Map:  10%|▉         | 4886/50002 [00:04<00:33, 1340.77 examples/s]Map:  10%|█         | 5071/50002 [00:04<00:36, 1245.67 examples/s]Map:  10%|█         | 5212/50002 [00:04<00:34, 1284.97 examples/s]Map:  11%|█         | 5348/50002 [00:04<00:34, 1303.00 examples/s]Map:  11%|█         | 5491/50002 [00:04<00:33, 1337.54 examples/s]Map:  11%|█▁        | 5628/50002 [00:04<00:32, 1344.86 examples/s]Map:  12%|█▁        | 5771/50002 [00:04<00:32, 1367.33 examples/s]Map:  12%|█▁        | 5914/50002 [00:04<00:31, 1381.45 examples/s]Map:  12%|█▁        | 6083/50002 [00:05<00:34, 1280.03 examples/s]Map:  12%|█▁        | 6222/50002 [00:05<00:33, 1307.68 examples/s]Map:  13%|█▎        | 6365/50002 [00:05<00:32, 1336.64 examples/s]Map:  13%|█▎        | 6504/50002 [00:05<00:32, 1348.29 examples/s]Map:  13%|█▎        | 6641/50002 [00:05<00:32, 1352.38 examples/s]Map:  14%|█▎        | 6780/50002 [00:05<00:31, 1359.64 examples/s]Map:  14%|█▁        | 6920/50002 [00:05<00:31, 1369.64 examples/s]Map:  14%|█▁        | 7090/50002 [00:05<00:33, 1274.62 examples/s]Map:  14%|█▁        | 7225/50002 [00:05<00:33, 1293.08 examples/s]Map:  15%|█▁        | 7372/50002 [00:06<00:31, 1340.51 examples/s]Map:  15%|█▌        | 7574/50002 [00:06<00:31, 1339.21 examples/s]Map:  15%|█▌        | 7714/50002 [00:06<00:31, 1353.47 examples/s]Map:  16%|█▌        | 7860/50002 [00:06<00:30, 1379.99 examples/s]Map:  16%|█▌        | 8000/50002 [00:06<00:33, 1270.77 examples/s]Map:  16%|█▋        | 8142/50002 [00:06<00:31, 1310.20 examples/s]Map:  17%|█▋        | 8283/50002 [00:06<00:31, 1336.97 examples/s]Map:  17%|█▋        | 8423/50002 [00:06<00:30, 1350.73 examples/s]Map:  17%|█▋        | 8561/50002 [00:06<00:30, 1356.40 examples/s]Map:  18%|█▊        | 8767/50002 [00:07<00:30, 1358.13 examples/s]Map:  18%|█▊        | 8912/50002 [00:07<00:29, 1377.18 examples/s]Map:  18%|█▊        | 9073/50002 [00:07<00:32, 1263.50 examples/s]Map:  18%|█▊        | 9207/50002 [00:07<00:31, 1278.74 examples/s]Map:  19%|█▊        | 9350/50002 [00:07<00:30, 1315.47 examples/s]Map:  19%|█▉        | 9490/50002 [00:07<00:30, 1336.52 examples/s]Map:  19%|█▉        | 9633/50002 [00:07<00:29, 1355.80 examples/s]Map:  20%|█▉        | 9777/50002 [00:07<00:29, 1378.43 examples/s]Map:  20%|█▉        | 9917/50002 [00:07<00:29, 1381.18 examples/s]Map:  20%|██        | 10086/50002 [00:08<00:31, 1281.64 examples/s]Map:  20%|██        | 10227/50002 [00:08<00:30, 1315.27 examples/s]Map:  21%|██        | 10363/50002 [00:08<00:29, 1323.96 examples/s]Map:  21%|██        | 10502/50002 [00:08<00:29, 1340.43 examples/s]Map:  21%|██▁       | 10712/50002 [00:08<00:28, 1359.86 examples/s]Map:  22%|██▁       | 10851/50002 [00:08<00:28, 1364.45 examples/s]Map:  22%|██▁       | 11005/50002 [00:08<00:31, 1238.94 examples/s]Map:  22%|██▁       | 11145/50002 [00:08<00:30, 1279.18 examples/s]Map:  23%|██▎       | 11284/50002 [00:08<00:29, 1305.70 examples/s]Map:  23%|██▎       | 11434/50002 [00:09<00:28, 1357.45 examples/s]Map:  23%|██▎       | 11572/50002 [00:09<00:28, 1358.48 examples/s]Map:  23%|██▎       | 11720/50002 [00:09<00:27, 1387.57 examples/s]Map:  24%|██▎       | 11864/50002 [00:09<00:27, 1401.47 examples/s]Map:  24%|██▁       | 12069/50002 [00:09<00:29, 1295.28 examples/s]Map:  24%|██▁       | 12207/50002 [00:09<00:28, 1316.49 examples/s]Map:  25%|██▁       | 12346/50002 [00:09<00:28, 1335.37 examples/s]Map:  25%|██▁       | 12485/50002 [00:09<00:27, 1349.39 examples/s]Map:  25%|██▌       | 12693/50002 [00:09<00:27, 1357.75 examples/s]Map:  26%|██▌       | 12833/50002 [00:10<00:27, 1365.93 examples/s]Map:  26%|██▌       | 12976/50002 [00:10<00:26, 1380.87 examples/s]Map:  26%|██▋       | 13154/50002 [00:10<00:28, 1305.57 examples/s]Map:  27%|██▋       | 13295/50002 [00:10<00:27, 1330.10 examples/s]Map:  27%|██▋       | 13437/50002 [00:10<00:27, 1351.98 examples/s]Map:  27%|██▋       | 13574/50002 [00:10<00:26, 1353.87 examples/s]Map:  27%|██▋       | 13719/50002 [00:10<00:26, 1377.80 examples/s]Map:  28%|██▊       | 13863/50002 [00:10<00:25, 1394.79 examples/s]Map:  28%|██▊       | 14072/50002 [00:11<00:27, 1286.99 examples/s]Map:  28%|██▊       | 14213/50002 [00:11<00:27, 1315.61 examples/s]Map:  29%|██▊       | 14350/50002 [00:11<00:26, 1327.69 examples/s]Map:  29%|██▉       | 14491/50002 [00:11<00:26, 1345.87 examples/s]Map:  29%|██▉       | 14635/50002 [00:11<00:25, 1370.10 examples/s]Map:  30%|██▉       | 14777/50002 [00:11<00:25, 1380.89 examples/s]Map:  30%|██▉       | 14986/50002 [00:11<00:25, 1381.23 examples/s]Map:  30%|███       | 15152/50002 [00:11<00:27, 1282.76 examples/s]Map:  31%|███       | 15294/50002 [00:11<00:26, 1314.33 examples/s]Map:  31%|███       | 15433/50002 [00:12<00:25, 1331.33 examples/s]Map:  31%|███       | 15584/50002 [00:12<00:24, 1377.32 examples/s]Map:  32%|███▁      | 15797/50002 [00:12<00:24, 1388.36 examples/s]Map:  32%|███▁      | 15943/50002 [00:12<00:24, 1405.97 examples/s]Map:  32%|███▁      | 16133/50002 [00:12<00:26, 1296.15 examples/s]Map:  33%|███▎      | 16268/50002 [00:12<00:25, 1308.36 examples/s]Map:  33%|███▎      | 16407/50002 [00:12<00:25, 1327.44 examples/s]Map:  33%|███▎      | 16549/50002 [00:12<00:24, 1351.09 examples/s]Map:  34%|███▎      | 16753/50002 [00:13<00:24, 1348.44 examples/s]Map:  34%|███▁      | 16896/50002 [00:13<00:24, 1365.02 examples/s]Map:  34%|███▁      | 17071/50002 [00:13<00:25, 1270.31 examples/s]Map:  34%|███▁      | 17205/50002 [00:13<00:25, 1285.03 examples/s]Map:  35%|███▁      | 17344/50002 [00:13<00:24, 1311.15 examples/s]Map:  35%|███▁      | 17494/50002 [00:13<00:23, 1360.52 examples/s]Map:  35%|███▌      | 17640/50002 [00:13<00:23, 1385.91 examples/s]Map:  36%|███▌      | 17835/50002 [00:13<00:23, 1349.77 examples/s]Map:  36%|███▌      | 17978/50002 [00:13<00:23, 1369.69 examples/s]Map:  36%|███▋      | 18145/50002 [00:14<00:25, 1274.11 examples/s]Map:  37%|███▋      | 18281/50002 [00:14<00:24, 1294.46 examples/s]Map:  37%|███▋      | 18434/50002 [00:14<00:23, 1353.56 examples/s]Map:  37%|███▋      | 18580/50002 [00:14<00:22, 1381.29 examples/s]Map:  37%|███▋      | 18728/50002 [00:14<00:22, 1404.61 examples/s]Map:  38%|███▊      | 18936/50002 [00:14<00:22, 1394.06 examples/s]Map:  38%|███▊      | 19144/50002 [00:14<00:23, 1306.12 examples/s]Map:  39%|███▊      | 19279/50002 [00:14<00:23, 1311.55 examples/s]Map:  39%|███▉      | 19424/50002 [00:15<00:22, 1343.88 examples/s]Map:  39%|███▉      | 19627/50002 [00:15<00:22, 1342.97 examples/s]Map:  40%|███▉      | 19772/50002 [00:15<00:22, 1365.67 examples/s]Map:  40%|███▉      | 19911/50002 [00:15<00:21, 1369.49 examples/s]Map:  40%|████      | 20086/50002 [00:15<00:23, 1293.34 examples/s]Map:  40%|████      | 20229/50002 [00:15<00:22, 1324.18 examples/s]Map:  41%|████      | 20369/50002 [00:15<00:22, 1338.77 examples/s]Map:  41%|████      | 20507/50002 [00:15<00:21, 1347.09 examples/s]Map:  41%|████▁     | 20647/50002 [00:15<00:21, 1356.82 examples/s]Map:  42%|████▁     | 20792/50002 [00:16<00:21, 1380.32 examples/s]Map:  42%|████▁     | 21000/50002 [00:16<00:22, 1279.45 examples/s]Map:  42%|████▁     | 21137/50002 [00:16<00:22, 1301.66 examples/s]Map:  43%|████▎     | 21277/50002 [00:16<00:21, 1326.02 examples/s]Map:  43%|████▎     | 21424/50002 [00:16<00:20, 1363.13 examples/s]Map:  43%|████▎     | 21567/50002 [00:16<00:20, 1380.91 examples/s]Map:  43%|████▎     | 21711/50002 [00:16<00:20, 1395.52 examples/s]Map:  44%|████▎     | 21856/50002 [00:16<00:20, 1405.57 examples/s]Map:  44%|████▁     | 22016/50002 [00:16<00:22, 1271.51 examples/s]Map:  44%|████▁     | 22167/50002 [00:17<00:20, 1332.82 examples/s]Map:  45%|████▁     | 22306/50002 [00:17<00:20, 1345.18 examples/s]Map:  45%|████▁     | 22448/50002 [00:17<00:20, 1364.05 examples/s]Map:  45%|████▌     | 22596/50002 [00:17<00:19, 1393.81 examples/s]Map:  45%|████▌     | 22741/50002 [00:17<00:19, 1403.09 examples/s]Map:  46%|████▌     | 22952/50002 [00:17<00:19, 1400.35 examples/s]Map:  46%|████▋     | 23132/50002 [00:17<00:20, 1280.03 examples/s]Map:  47%|████▋     | 23274/50002 [00:17<00:20, 1312.54 examples/s]Map:  47%|████▋     | 23415/50002 [00:17<00:19, 1336.37 examples/s]Map:  47%|████▋     | 23559/50002 [00:18<00:19, 1360.58 examples/s]Map:  47%|████▋     | 23701/50002 [00:18<00:19, 1375.83 examples/s]Map:  48%|████▊     | 23911/50002 [00:18<00:18, 1379.57 examples/s]Map:  48%|████▊     | 24079/50002 [00:18<00:20, 1287.25 examples/s]Map:  48%|████▊     | 24217/50002 [00:18<00:19, 1305.96 examples/s]Map:  49%|████▊     | 24357/50002 [00:18<00:19, 1328.85 examples/s]Map:  49%|████▉     | 24499/50002 [00:18<00:18, 1351.04 examples/s]Map:  49%|████▉     | 24641/50002 [00:18<00:18, 1369.58 examples/s]Map:  50%|████▉     | 24841/50002 [00:19<00:18, 1352.67 examples/s]Map:  50%|████▉     | 24980/50002 [00:19<00:18, 1356.56 examples/s]Map:  50%|█████     | 25148/50002 [00:19<00:19, 1268.65 examples/s]Map:  51%|█████     | 25296/50002 [00:19<00:18, 1319.45 examples/s]Map:  51%|█████     | 25438/50002 [00:19<00:18, 1344.15 examples/s]Map:  51%|█████     | 25578/50002 [00:19<00:18, 1356.79 examples/s]Map:  51%|█████▁    | 25718/50002 [00:19<00:17, 1365.13 examples/s]Map:  52%|█████▁    | 25860/50002 [00:19<00:17, 1379.00 examples/s]Map:  52%|█████▁    | 26019/50002 [00:19<00:19, 1251.52 examples/s]Map:  52%|█████▁    | 26166/50002 [00:20<00:18, 1306.50 examples/s]Map:  53%|█████▎    | 26302/50002 [00:20<00:17, 1319.36 examples/s]Map:  53%|█████▎    | 26456/50002 [00:20<00:17, 1377.00 examples/s]Map:  53%|█████▎    | 26602/50002 [00:20<00:16, 1396.98 examples/s]Map:  53%|█████▎    | 26750/50002 [00:20<00:16, 1416.36 examples/s]Map:  54%|█████▁    | 26894/50002 [00:20<00:16, 1420.20 examples/s]Map:  54%|█████▁    | 27069/50002 [00:20<00:17, 1294.97 examples/s]Map:  54%|█████▁    | 27213/50002 [00:20<00:17, 1330.96 examples/s]Map:  55%|█████▁    | 27360/50002 [00:20<00:16, 1365.78 examples/s]Map:  55%|█████▌    | 27569/50002 [00:21<00:16, 1371.11 examples/s]Map:  56%|█████▌    | 27771/50002 [00:21<00:16, 1362.24 examples/s]Map:  56%|█████▌    | 27917/50002 [00:21<00:15, 1382.53 examples/s]Map:  56%|█████▌    | 28089/50002 [00:21<00:16, 1298.40 examples/s]Map:  56%|█████▋    | 28236/50002 [00:21<00:16, 1339.90 examples/s]Map:  57%|█████▋    | 28379/50002 [00:21<00:15, 1360.52 examples/s]Map:  57%|█████▋    | 28521/50002 [00:21<00:15, 1372.06 examples/s]Map:  57%|█████▋    | 28667/50002 [00:21<00:15, 1395.11 examples/s]Map:  58%|█████▊    | 28877/50002 [00:22<00:15, 1388.84 examples/s]Map:  58%|█████▊    | 29075/50002 [00:22<00:16, 1306.14 examples/s]Map:  58%|█████▊    | 29218/50002 [00:22<00:15, 1329.83 examples/s]Map:  59%|█████▊    | 29356/50002 [00:22<00:15, 1338.29 examples/s]Map:  59%|█████▉    | 29500/50002 [00:22<00:15, 1365.07 examples/s]Map:  59%|█████▉    | 29709/50002 [00:22<00:14, 1370.26 examples/s]Map:  60%|█████▉    | 29852/50002 [00:22<00:14, 1385.48 examples/s]Map:  60%|█████▉    | 29995/50002 [00:22<00:14, 1393.47 examples/s]Map:  60%|██████    | 30162/50002 [00:22<00:15, 1284.31 examples/s]Map:  61%|██████    | 30311/50002 [00:23<00:14, 1335.22 examples/s]Map:  61%|██████    | 30457/50002 [00:23<00:14, 1368.41 examples/s]Map:  61%|██████▁   | 30666/50002 [00:23<00:14, 1374.79 examples/s]Map:  62%|██████▁   | 30864/50002 [00:23<00:14, 1351.87 examples/s]Map:  62%|██████▁   | 31071/50002 [00:23<00:14, 1270.59 examples/s]Map:  62%|██████▁   | 31216/50002 [00:23<00:14, 1307.99 examples/s]Map:  63%|██████▎   | 31353/50002 [00:23<00:14, 1320.15 examples/s]Map:  63%|██████▎   | 31499/50002 [00:23<00:13, 1353.66 examples/s]Map:  63%|██████▎   | 31642/50002 [00:24<00:13, 1369.80 examples/s]Map:  64%|██████▎   | 31842/50002 [00:24<00:13, 1349.42 examples/s]Map:  64%|██████▁   | 31981/50002 [00:24<00:13, 1359.55 examples/s]Map:  64%|██████▁   | 32145/50002 [00:24<00:14, 1263.30 examples/s]Map:  65%|██████▁   | 32291/50002 [00:24<00:13, 1311.30 examples/s]Map:  65%|██████▁   | 32429/50002 [00:24<00:13, 1324.46 examples/s]Map:  65%|██████▌   | 32567/50002 [00:24<00:13, 1336.31 examples/s]Map:  65%|██████▌   | 32708/50002 [00:24<00:12, 1356.41 examples/s]Map:  66%|██████▌   | 32851/50002 [00:24<00:12, 1375.92 examples/s]Map:  66%|██████▌   | 32991/50002 [00:25<00:12, 1381.12 examples/s]Map:  66%|██████▋   | 33152/50002 [00:25<00:13, 1260.11 examples/s]Map:  67%|██████▋   | 33298/50002 [00:25<00:12, 1310.38 examples/s]Map:  67%|██████▋   | 33437/50002 [00:25<00:12, 1329.52 examples/s]Map:  67%|██████▋   | 33575/50002 [00:25<00:12, 1340.73 examples/s]Map:  67%|██████▋   | 33714/50002 [00:25<00:12, 1351.87 examples/s]Map:  68%|██████▊   | 33860/50002 [00:25<00:11, 1378.70 examples/s]Map:  68%|██████▊   | 34000/50002 [00:25<00:12, 1245.98 examples/s]Map:  68%|██████▊   | 34179/50002 [00:26<00:12, 1223.09 examples/s]Map:  69%|██████▊   | 34357/50002 [00:26<00:12, 1208.75 examples/s]Map:  69%|██████▉   | 34538/50002 [00:26<00:12, 1201.91 examples/s]Map:  69%|██████▉   | 34661/50002 [00:26<00:12, 1206.86 examples/s]Map:  70%|██████▉   | 34784/50002 [00:26<00:12, 1211.91 examples/s]Map:  70%|██████▉   | 34952/50002 [00:26<00:12, 1174.65 examples/s]Map:  70%|███████   | 35077/50002 [00:26<00:12, 1160.27 examples/s]Map:  70%|███████   | 35222/50002 [00:26<00:12, 1231.07 examples/s]Map:  71%|███████   | 35370/50002 [00:27<00:11, 1295.91 examples/s]Map:  71%|███████   | 35514/50002 [00:27<00:10, 1330.24 examples/s]Map:  71%|███████▁  | 35655/50002 [00:27<00:10, 1349.51 examples/s]Map:  72%|███████▁  | 35865/50002 [00:27<00:10, 1358.91 examples/s]Map:  72%|███████▁  | 36069/50002 [00:27<00:10, 1290.92 examples/s]Map:  72%|███████▁  | 36205/50002 [00:27<00:10, 1304.05 examples/s]Map:  73%|███████▎  | 36350/50002 [00:27<00:10, 1334.46 examples/s]Map:  73%|███████▎  | 36497/50002 [00:27<00:09, 1364.43 examples/s]Map:  73%|███████▎  | 36639/50002 [00:27<00:09, 1378.82 examples/s]Map:  74%|███████▎  | 36783/50002 [00:28<00:09, 1393.30 examples/s]Map:  74%|███████▁  | 36990/50002 [00:28<00:09, 1378.50 examples/s]Map:  74%|███████▁  | 37148/50002 [00:28<00:10, 1260.79 examples/s]Map:  75%|███████▁  | 37283/50002 [00:28<00:09, 1281.37 examples/s]Map:  75%|███████▁  | 37422/50002 [00:28<00:09, 1307.88 examples/s]Map:  75%|███████▌  | 37625/50002 [00:28<00:09, 1319.38 examples/s]Map:  76%|███████▌  | 37771/50002 [00:28<00:09, 1352.81 examples/s]Map:  76%|███████▌  | 37972/50002 [00:28<00:08, 1339.93 examples/s]Map:  76%|███████▋  | 38141/50002 [00:29<00:09, 1255.32 examples/s]Map:  77%|███████▋  | 38281/50002 [00:29<00:09, 1284.50 examples/s]Map:  77%|███████▋  | 38424/50002 [00:29<00:08, 1319.54 examples/s]Map:  77%|███████▋  | 38572/50002 [00:29<00:08, 1362.03 examples/s]Map:  77%|███████▋  | 38715/50002 [00:29<00:08, 1380.01 examples/s]Map:  78%|███████▊  | 38866/50002 [00:29<00:07, 1410.25 examples/s]Map:  78%|███████▊  | 39069/50002 [00:29<00:08, 1300.36 examples/s]Map:  78%|███████▊  | 39214/50002 [00:29<00:08, 1333.56 examples/s]Map:  79%|███████▊  | 39356/50002 [00:29<00:07, 1354.47 examples/s]Map:  79%|███████▉  | 39500/50002 [00:30<00:07, 1375.15 examples/s]Map:  79%|███████▉  | 39704/50002 [00:30<00:07, 1366.67 examples/s]Map:  80%|███████▉  | 39845/50002 [00:30<00:07, 1375.29 examples/s]Map:  80%|███████▉  | 39990/50002 [00:30<00:07, 1392.28 examples/s]Map:  80%|████████  | 40158/50002 [00:30<00:07, 1289.35 examples/s]Map:  81%|████████  | 40303/50002 [00:30<00:07, 1328.22 examples/s]Map:  81%|████████  | 40440/50002 [00:30<00:07, 1339.33 examples/s]Map:  81%|████████▁ | 40638/50002 [00:30<00:07, 1328.01 examples/s]Map:  82%|████████▁ | 40774/50002 [00:31<00:06, 1332.87 examples/s]Map:  82%|████████▁ | 40917/50002 [00:31<00:06, 1356.64 examples/s]Map:  82%|████████▁ | 41082/50002 [00:31<00:07, 1259.50 examples/s]Map:  82%|████████▁ | 41221/50002 [00:31<00:06, 1292.02 examples/s]Map:  83%|████████▎ | 41363/50002 [00:31<00:06, 1320.63 examples/s]Map:  83%|████████▎ | 41503/50002 [00:31<00:06, 1341.18 examples/s]Map:  83%|████████▎ | 41711/50002 [00:31<00:06, 1352.63 examples/s]Map:  84%|████████▎ | 41854/50002 [00:31<00:05, 1371.25 examples/s]Map:  84%|████████▁ | 42019/50002 [00:32<00:06, 1271.07 examples/s]Map:  84%|████████▁ | 42158/50002 [00:32<00:06, 1299.37 examples/s]Map:  85%|████████▁ | 42303/50002 [00:32<00:05, 1335.90 examples/s]Map:  85%|████████▁ | 42442/50002 [00:32<00:05, 1349.52 examples/s]Map:  85%|████████▌ | 42580/50002 [00:32<00:05, 1354.22 examples/s]Map:  85%|████████▌ | 42731/50002 [00:32<00:05, 1394.25 examples/s]Map:  86%|████████▌ | 42872/50002 [00:32<00:05, 1391.89 examples/s]Map:  86%|████████▌ | 43073/50002 [00:32<00:05, 1308.29 examples/s]Map:  86%|████████▋ | 43215/50002 [00:32<00:05, 1335.44 examples/s]Map:  87%|████████▋ | 43352/50002 [00:32<00:04, 1342.89 examples/s]Map:  87%|████████▋ | 43491/50002 [00:33<00:04, 1351.05 examples/s]Map:  87%|████████▋ | 43635/50002 [00:33<00:04, 1375.18 examples/s]Map:  88%|████████▊ | 43845/50002 [00:33<00:04, 1382.10 examples/s]Map:  88%|████████▊ | 43986/50002 [00:33<00:04, 1384.38 examples/s]Map:  88%|████████▊ | 44154/50002 [00:33<00:04, 1287.12 examples/s]Map:  89%|████████▊ | 44301/50002 [00:33<00:04, 1328.89 examples/s]Map:  89%|████████▉ | 44439/50002 [00:33<00:04, 1339.35 examples/s]Map:  89%|████████▉ | 44582/50002 [00:33<00:03, 1363.04 examples/s]Map:  89%|████████▉ | 44726/50002 [00:33<00:03, 1383.01 examples/s]Map:  90%|████████▉ | 44868/50002 [00:34<00:03, 1388.05 examples/s]Map:  90%|█████████ | 45065/50002 [00:34<00:03, 1284.50 examples/s]Map:  90%|█████████ | 45213/50002 [00:34<00:03, 1332.64 examples/s]Map:  91%|█████████ | 45361/50002 [00:34<00:03, 1369.81 examples/s]Map:  91%|█████████ | 45502/50002 [00:34<00:03, 1375.34 examples/s]Map:  91%|█████████▁| 45646/50002 [00:34<00:03, 1388.89 examples/s]Map:  92%|█████████▁| 45793/50002 [00:34<00:02, 1410.15 examples/s]Map:  92%|█████████▁| 45996/50002 [00:34<00:02, 1381.63 examples/s]Map:  92%|█████████▁| 46164/50002 [00:35<00:02, 1286.14 examples/s]Map:  93%|█████████▎| 46308/50002 [00:35<00:02, 1320.35 examples/s]Map:  93%|█████████▎| 46448/50002 [00:35<00:02, 1338.35 examples/s]Map:  93%|█████████▎| 46587/50002 [00:35<00:02, 1351.82 examples/s]Map:  93%|█████████▎| 46733/50002 [00:35<00:02, 1379.31 examples/s]Map:  94%|█████████▎| 46874/50002 [00:35<00:02, 1383.84 examples/s]Map:  94%|█████████▁| 47068/50002 [00:35<00:02, 1279.32 examples/s]Map:  94%|█████████▁| 47209/50002 [00:35<00:02, 1312.24 examples/s]Map:  95%|█████████▁| 47348/50002 [00:35<00:01, 1328.38 examples/s]Map:  95%|█████████▁| 47488/50002 [00:36<00:01, 1346.52 examples/s]Map:  95%|█████████▌| 47626/50002 [00:36<00:01, 1353.34 examples/s]Map:  96%|█████████▌| 47768/50002 [00:36<00:01, 1369.67 examples/s]Map:  96%|█████████▌| 47911/50002 [00:36<00:01, 1383.76 examples/s]Map:  96%|█████████▌| 48073/50002 [00:36<00:01, 1262.22 examples/s]Map:  96%|█████████▋| 48206/50002 [00:36<00:01, 1278.13 examples/s]Map:  97%|█████████▋| 48350/50002 [00:36<00:01, 1320.02 examples/s]Map:  97%|█████████▋| 48492/50002 [00:36<00:01, 1346.26 examples/s]Map:  97%|█████████▋| 48633/50002 [00:36<00:01, 1362.38 examples/s]Map:  98%|█████████▊| 48842/50002 [00:37<00:00, 1370.20 examples/s]Map:  98%|█████████▊| 48983/50002 [00:37<00:00, 1378.87 examples/s]Map:  98%|█████████▊| 49155/50002 [00:37<00:00, 1291.07 examples/s]Map:  99%|█████████▊| 49299/50002 [00:37<00:00, 1326.99 examples/s]Map:  99%|█████████▉| 49449/50002 [00:37<00:00, 1370.59 examples/s]Map:  99%|█████████▉| 49592/50002 [00:37<00:00, 1381.88 examples/s]Map: 100%|█████████▉| 49799/50002 [00:37<00:00, 1377.69 examples/s]Map: 100%|█████████▉| 49939/50002 [00:37<00:00, 1378.60 examples/s]                                                                   Map:   0%|          | 0/2000 [00:00<?, ? examples/s]Map:   7%|▋         | 134/2000 [00:00<00:01, 1323.33 examples/s]Map:  14%|█▁        | 283/2000 [00:00<00:01, 1409.06 examples/s]Map:  21%|██        | 424/2000 [00:00<00:01, 1403.94 examples/s]Map:  32%|███▁      | 632/2000 [00:00<00:00, 1388.78 examples/s]Map:  39%|███▉      | 780/2000 [00:00<00:00, 1414.06 examples/s]Map:  46%|████▌     | 922/2000 [00:00<00:00, 1412.62 examples/s]Map:  55%|█████▁    | 1095/2000 [00:00<00:00, 1306.37 examples/s]Map:  62%|██████▁   | 1241/2000 [00:00<00:00, 1343.81 examples/s]Map:  69%|██████▉   | 1382/2000 [00:01<00:00, 1358.17 examples/s]Map:  76%|███████▌  | 1524/2000 [00:01<00:00, 1371.23 examples/s]Map:  83%|████████▎ | 1664/2000 [00:01<00:00, 1376.44 examples/s]Map:  90%|█████████ | 1808/2000 [00:01<00:00, 1390.95 examples/s]Map:  98%|█████████▊| 1957/2000 [00:01<00:00, 1407.88 examples/s]                                                                 wandb: Currently logged in as: gaoxiaoce0428. Use `wandb login --relogin` to force relogin
wandb: Tracking run with wandb version 0.15.2
wandb: Run data is saved locally in /home/tricorder/test/gxc/alpaca_lora_env/alpaca-lora/wandb/run-20230508_062039-uby8fkaf
wandb: Run `wandb offline` to turn off syncing.
wandb: Syncing run  
wandb: ⭐️ View project at https://wandb.ai/gaoxiaoce0428/llama_test_project
wandb: 🚀 View run at https://wandb.ai/gaoxiaoce0428/llama_test_project/runs/uby8fkaf
  0%|          | 0/72 [00:00<?, ?it/s]/home/tricorder/yang/anaconda3/envs/llama_alpaca_lora/lib/python3.10/site-packages/bitsandbytes/autograd/_functions.py:318: UserWarning: MatMul8bitLt: inputs will be cast from torch.float32 to float16 during quantization
  warnings.warn(f"MatMul8bitLt: inputs will be cast from {A.dtype} to float16 during quantization")
  1%|▁         | 1/72 [19:11<22:42:31, 1151.43s/it]  3%|▎         | 2/72 [34:35<19:47:30, 1017.86s/it]  4%|▁         | 3/72 [51:03<19:14:52, 1004.24s/it]  6%|▌         | 4/72 [1:06:06<18:12:37, 964.08s/it]  7%|▋         | 5/72 [1:19:56<17:02:37, 915.78s/it]  8%|▊         | 6/72 [1:32:49<15:54:07, 867.39s/it] 10%|▉         | 7/72 [1:52:07<17:22:19, 962.15s/it] 11%|█         | 8/72 [2:07:34<16:54:34, 951.16s/it] 12%|█▎        | 9/72 [2:23:24<16:38:13, 950.69s/it] 14%|█▁        | 10/72 [2:38:38<16:10:37, 939.31s/it]                                                      14%|█▁        | 10/72 [2:38:38<16:10:37, 939.31s/it] 15%|█▌        | 11/72 [2:52:39<15:24:22, 909.22s/it] 17%|█▋        | 12/72 [3:09:04<15:32:17, 932.29s/it] 18%|█▊        | 13/72 [3:39:54<19:50:09, 1210.32s/it] 19%|█▉        | 14/72 [4:13:57<23:33:02, 1461.76s/it] 21%|██        | 15/72 [4:48:14<25:59:17, 1641.37s/it] 22%|██▁       | 16/72 [5:19:43<26:41:24, 1715.80s/it] 24%|██▎       | 17/72 [5:33:24<22:06:04, 1446.63s/it] 25%|██▌       | 18/72 [5:46:23<18:41:31, 1246.13s/it] 26%|██▋       | 19/72 [6:05:55<18:01:02, 1223.81s/it] 28%|██▊       | 20/72 [6:31:18<18:58:27, 1313.60s/it]                                                       28%|██▊       | 20/72 [6:31:18<18:58:27, 1313.60s/it] 29%|██▉       | 21/72 [7:04:18<21:26:37, 1513.67s/it] 31%|███       | 22/72 [7:40:12<23:41:30, 1705.80s/it] 32%|███▁      | 23/72 [8:13:13<24:20:38, 1788.53s/it] 33%|███▎      | 24/72 [8:43:58<24:04:19, 1805.40s/it] 35%|███▁      | 25/72 [9:23:27<25:46:37, 1974.42s/it] 36%|███▌      | 26/72 [9:59:48<26:01:18, 2036.48s/it] 38%|███▊      | 27/72 [10:33:08<25:19:16, 2025.71s/it] 39%|███▉      | 28/72 [11:09:41<25:22:17, 2075.84s/it] 40%|████      | 29/72 [11:42:30<24:24:33, 2043.57s/it] 42%|████▁     | 30/72 [12:13:32<23:12:26, 1989.20s/it]                                                        42%|████▁     | 30/72 [12:13:32<23:12:26, 1989.20s/it] 43%|████▎     | 31/72 [12:51:38<23:40:13, 2078.38s/it] 44%|████▁     | 32/72 [13:27:50<23:24:17, 2106.44s/it] 46%|████▌     | 33/72 [14:01:33<22:32:49, 2081.26s/it] 47%|████▋     | 34/72 [14:37:41<22:14:42, 2107.43s/it] 49%|████▊     | 35/72 [15:11:13<21:21:55, 2078.80s/it] 50%|█████     | 36/72 [15:42:35<20:11:43, 2019.55s/it] 51%|█████▁    | 37/72 [16:20:45<20:25:32, 2100.92s/it] 53%|█████▎    | 38/72 [16:57:20<20:06:28, 2129.08s/it] 54%|█████▁    | 39/72 [17:30:51<19:11:28, 2093.60s/it] 56%|█████▌    | 40/72 [18:07:09<18:50:01, 2118.79s/it]                                                        56%|█████▌    | 40/72 [18:07:09<18:50:01, 2118.79s/it] 57%|█████▋    | 41/72 [18:40:59<18:01:04, 2092.40s/it] 58%|█████▊    | 42/72 [19:12:25<16:55:10, 2030.35s/it] 60%|█████▉    | 43/72 [19:51:08<17:03:46, 2118.14s/it] 61%|██████    | 44/72 [20:21:08<15:43:55, 2022.71s/it]wandb: Network error (ConnectTimeout), entering retry loop.
 62%|██████▎   | 45/72 [20:35:59<12:37:29, 1683.31s/it] 64%|██████▁   | 46/72 [20:52:11<10:36:52, 1469.72s/it] 65%|██████▌   | 47/72 [21:11:03<9:30:12, 1368.49s/it]  67%|██████▋   | 48/72 [21:28:29<8:28:39, 1271.63s/it] 68%|██████▊   | 49/72 [21:48:43<8:00:53, 1254.52s/it] 69%|██████▉   | 50/72 [22:09:35<7:39:42, 1253.77s/it]                                                       69%|██████▉   | 50/72 [22:09:35<7:39:42, 1253.77s/it] 71%|███████   | 51/72 [22:28:26<7:05:55, 1216.92s/it] 72%|███████▁  | 52/72 [22:47:22<6:37:33, 1192.70s/it] 74%|███████▎  | 53/72 [23:06:50<6:15:18, 1185.20s/it] 75%|███████▌  | 54/72 [23:24:47<5:45:50, 1152.79s/it] 76%|███████▋  | 55/72 [23:43:46<5:25:24, 1148.52s/it] 78%|███████▊  | 56/72 [24:01:39<5:00:16, 1126.03s/it] 79%|███████▉  | 57/72 [24:19:41<4:38:10, 1112.73s/it] 81%|████████  | 58/72 [24:40:29<4:29:05, 1153.23s/it] 82%|████████▁ | 59/72 [25:02:36<4:21:09, 1205.34s/it] 83%|████████▎ | 60/72 [25:23:40<4:04:38, 1223.17s/it]                                                       83%|████████▎ | 60/72 [25:23:40<4:04:38, 1223.17s/it] 85%|████████▁ | 61/72 [25:45:48<3:50:00, 1254.57s/it] 86%|████████▌ | 62/72 [26:08:31<3:34:31, 1287.11s/it] 88%|████████▊ | 63/72 [26:29:39<3:12:12, 1281.44s/it] 89%|████████▉ | 64/72 [26:50:33<2:49:44, 1273.01s/it] 90%|█████████ | 65/72 [27:12:40<2:30:23, 1289.13s/it] 92%|█████████▁| 66/72 [27:32:00<2:05:03, 1250.61s/it] 93%|█████████▎| 67/72 [27:52:32<1:43:44, 1244.90s/it] 94%|█████████▁| 68/72 [28:14:51<1:24:52, 1273.21s/it] 96%|█████████▌| 69/72 [28:35:24<1:03:03, 1261.01s/it] 97%|█████████▋| 70/72 [28:57:04<42:25, 1272.76s/it]                                                       97%|█████████▋| 70/72 [28:57:04<42:25, 1272.76s/it] 99%|█████████▊| 71/72 [29:18:52<21:23, 1283.31s/it]100%|██████████| 72/72 [29:38:42<00:00, 1255.24s/it]                                                    100%|██████████| 72/72 [29:38:42<00:00, 1255.24s/it]100%|██████████| 72/72 [29:38:42<00:00, 1482.25s/it]
ERROR: Could not consume arg:  
Usage: finetune.py ' ' ' ' --base_model /home/tricorder/test/gxc/decapoda-research/llama-7b-hf ' ' ' ' --data_path ../data/alpaca_data.json ' ' ' ' --output_dir ../lora_alpaca_output_free/source_2048 ' ' ' ' --batch_size 2048 ' ' ' ' --micro_batch_size 4 ' ' ' ' --num_epochs 3 ' ' ' ' --learning_rate 2e-5 ' ' ' ' --cutoff_len 512 ' ' ' ' --val_set_size 2000 ' ' ' ' --lora_r

For detailed information on this command, run:
  finetune.py ' ' ' ' --base_model /home/tricorder/test/gxc/decapoda-research/llama-7b-hf ' ' ' ' --data_path ../data/alpaca_data.json ' ' ' ' --output_dir ../lora_alpaca_output_free/source_2048 ' ' ' ' --batch_size 2048 ' ' ' ' --micro_batch_size 4 ' ' ' ' --num_epochs 3 ' ' ' ' --learning_rate 2e-5 ' ' ' ' --cutoff_len 512 ' ' ' ' --val_set_size 2000 ' ' ' ' --lora_r --help
{'loss': 2.3606, 'learning_rate': 2.0000000000000003e-06, 'epoch': 0.41}
{'loss': 2.451, 'learning_rate': 4.000000000000001e-06, 'epoch': 0.82}
{'loss': 2.4714, 'learning_rate': 6e-06, 'epoch': 1.23}
{'loss': 2.3117, 'learning_rate': 8.000000000000001e-06, 'epoch': 1.64}
{'loss': 2.3747, 'learning_rate': 1e-05, 'epoch': 2.05}
{'loss': 2.293, 'learning_rate': 1.2e-05, 'epoch': 2.46}
{'loss': 2.1703, 'learning_rate': 1.4e-05, 'epoch': 2.87}
{'train_runtime': 106727.3492, 'train_samples_per_second': 1.406, 'train_steps_per_second': 0.001, 'train_loss': 2.3480590184529624, 'epoch': 2.95}

 If there's a warning about missing keys above, please disregard :)
wandb: Waiting for W&B process to finish... (success).
wandb: - 0.011 MB of 0.011 MB uploaded (0.000 MB deduped)wandb: \ 0.011 MB of 0.011 MB uploaded (0.000 MB deduped)wandb: | 0.011 MB of 0.011 MB uploaded (0.000 MB deduped)wandb: / 0.011 MB of 0.011 MB uploaded (0.000 MB deduped)wandb: - 0.011 MB of 0.011 MB uploaded (0.000 MB deduped)wandb: \ 0.011 MB of 0.011 MB uploaded (0.000 MB deduped)wandb: | 0.011 MB of 0.011 MB uploaded (0.000 MB deduped)wandb: / 0.011 MB of 0.011 MB uploaded (0.000 MB deduped)wandb: - 0.011 MB of 0.011 MB uploaded (0.000 MB deduped)wandb: \ 0.011 MB of 0.011 MB uploaded (0.000 MB deduped)wandb: 
wandb: Run history:
wandb:                    train/epoch ▁▂▃▄▆▇██
wandb:              train/global_step ▁▂▃▄▆▇██
wandb:            train/learning_rate ▁▂▃▄▆▇█
wandb:                     train/loss ▅██▄▆▄▁
wandb:               train/total_flos ▁
wandb:               train/train_loss ▁
wandb:            train/train_runtime ▁
wandb: train/train_samples_per_second ▁
wandb:   train/train_steps_per_second ▁
wandb: 
wandb: Run summary:
wandb:                    train/epoch 2.95
wandb:              train/global_step 72
wandb:            train/learning_rate 1e-05
wandb:                     train/loss 2.1703
wandb:               train/total_flos 7.740678580745011e+17
wandb:               train/train_loss 2.34806
wandb:            train/train_runtime 106727.3492
wandb: train/train_samples_per_second 1.406
wandb:   train/train_steps_per_second 0.001
wandb: 
wandb: 🚀 View run   at: https://wandb.ai/gaoxiaoce0428/llama_test_project/runs/uby8fkaf
wandb: Synced 6 W&B file(s), 0 media file(s), 0 artifact file(s) and 0 other file(s)
wandb: Find logs at: ./wandb/run-20230508_062039-uby8fkaf/logs
